{
  "$schema": "https://json-schema.org/draft/2020-12/schema",
  "title": "refs_manifest",
  "type": "object",
  "required": [
    "manuscript",
    "entries"
  ],
  "properties": {
    "manuscript": {
      "type": "string"
    },
    "manuscript_sha256": {
      "description": "sha256 of the audited manuscript's bytes — the case folder's content identity. Absent on manifests written before content hashing, which fall back to comparing the file name.",
      "type": [
        "string",
        "null"
      ]
    },
    "summary": {
      "type": "object"
    },
    "entries": {
      "type": "array",
      "items": {
        "type": "object",
        "required": [
          "num",
          "raw",
          "status"
        ],
        "properties": {
          "num": {
            "type": "string"
          },
          "raw": {
            "type": "string"
          },
          "doi": {
            "type": [
              "string",
              "null"
            ]
          },
          "title": {
            "type": [
              "string",
              "null"
            ]
          },
          "year": {
            "type": [
              "string",
              "null"
            ]
          },
          "status": {
            "enum": [
              "retrieved",
              "provided",
              "paywalled",
              "mismatch",
              "no_doi",
              "unpublished",
              "error"
            ]
          },
          "reason": {
            "type": "string"
          },
          "resolver": {
            "type": [
              "string",
              "null"
            ]
          },
          "pdf_path": {
            "type": [
              "string",
              "null"
            ]
          },
          "slug": {
            "type": [
              "string",
              "null"
            ]
          },
          "boundary_ambiguous": {
            "type": "boolean",
            "description": "True when the reference label occurred more than once before the next reference, so the entry's start is a guess. Such an entry is never resolved: nothing derived from its text may be trusted to name a paper."
          },
          "seen_in": {
            "type": "array",
            "description": "Which named readings of the bibliography (e.g. \"parsed\", \"pymupdf\", \"llm\") contributed this entry. Absent means never computed — either an entry from a manifest written before this feature, or one whose candidate reading was never compared against others. An entry seen only in the model's reading is spottable as a list of length one.",
            "items": {
              "type": "string"
            }
          },
          "title_check": {
            "type": [
              "string",
              "null"
            ],
            "enum": [
              "verified",
              "unverifiable",
              "mismatch",
              null
            ],
            "description": "Whether anyone established that the retrieved or provided file is the paper the reference names. 'unverifiable' (e.g. a scanned first page) is not 'verified' and must never be reported as a match."
          },
          "supplements": {
            "type": "array",
            "description": "Supplementary files the user supplied for this reference, each judged as its own document. Only ever non-empty when the reference itself is available: a supplement with no article behind it is set aside rather than allowed to stand in for the cited source. Absent on manifests written before 0.6.0, where it means none were supplied. Note that no supplement carries a title_check — a supplement's own title does not match its parent's, so the identity check that guards every article cannot apply, and these are attached on a filename match alone.",
            "items": {
              "type": "object",
              "required": [
                "slug",
                "pdf_path"
              ],
              "properties": {
                "slug": {
                  "type": "string",
                  "description": "The id this document is read, ingested and cropped under: ingest/<slug>/ and sources_resolved/<slug>.pdf. Derived from the file stem and never from an ordinal position in the folder, so removing one file cannot silently re-point another document's stored verdicts."
                },
                "pdf_path": {
                  "type": "string",
                  "description": "Local path to the supplementary PDF, as supplied by the user."
                },
                "verified": {
                  "type": "boolean",
                  "description": "Did anything establish that this file belongs to the reference it is attached to? True when the file's own title or DOI named that work. False when it was attached because its FILENAME carried the reference's tokens — a guess nobody checked. Absent on manifests written before 0.6.0, meaning false. The report distinguishes the two rather than warning about both equally."
                }
              }
            }
          }
        }
      }
    },
    "references_resumed": {
      "type": "boolean",
      "description": "True when the reference list was picked up again after an intervening section, so the entry numbering spans a boundary the parser chose to cross. Gated on block type and run length, but still a judgement — the reader should be able to check it."
    },
    "reference_source": {
      "enum": [
        "crossref",
        "parsed"
      ],
      "description": "Which reading of the reference list these entries came from: the publisher's list deposited with Crossref, or the tool's own parse of the PDF text. Absent on manifests written before reconciliation, which are all parses."
    },
    "numbering_verified": {
      "type": "boolean",
      "description": "True when the chosen list accounts for exactly the labels the manuscript's body cites AND no entry in it refuses its own label. The second condition is not redundant: a refused entry keeps a positional label, so the extent check is satisfied by exactly the labels in doubt. The label is the join key between a claim and its source, so an unverified numbering means a verdict may be about a different paper than the label names. Absent on older manifests, which never checked."
    },
    "numbering_note": {
      "type": "string",
      "description": "Why the numbering was or was not confirmed, in the reader's terms — the counts each reading produced and what the body cites."
    },
    "unverified_from": {
      "type": [
        "integer",
        "null"
      ],
      "minimum": 1,
      "description": "The first citation label from which the numbering is in doubt, or null when it is not in doubt. 1 means 'from the very start', which is what a single unchecked reading warrants: one candidate gives no evidence about where it went wrong."
    },
    "numbering_contested": {
      "type": "boolean",
      "description": "The two readings of the bibliography stop describing the same paper at or below a label the body cites, even though the chosen reading matched the body's labels — so the other reading either names a different work at an entry some verdict rests on, or ends before reaching it. NOT 'the other reading failed the extent check': a deposit identical for every cited label and longer by two references nobody cites fails that. Absent on manifests written before 0.7."
    },
    "numbering_ledger": {
      "type": "object",
      "description": "The labels the PARSED list carries, against the labels the body cites: which are duplicated, and which are carried by no entry. Always about the parsed list, even on a `reference_source: \"crossref\"` run where `entries` holds the deposit instead — which is exactly the case a reader inspects this for. Absent means never computed, not that nothing was dropped. Nothing is required: a reader must treat any key as possibly missing.",
      "properties": {
        "labels_detected": {
          "type": "integer",
          "description": "How many distinct bracketed numeric labels the body cites. Only that style can be read, so 0 means 'none readable', not 'none cited'."
        },
        "labels_max": {
          "type": "integer",
          "description": "The highest label the body cites. Under citation-order numbering the list should be exactly this long."
        },
        "labels_absent": {
          "type": "array",
          "description": "Labels from 1 to `labels_max` that the body never cites — a hole in the body's own citing, not in the parse.",
          "items": {
            "type": "string"
          }
        },
        "entries_parsed": {
          "type": "integer",
          "description": "How many entries the PDF parse produced."
        },
        "numerals_distinct": {
          "type": "integer",
          "description": "How many distinct labels those parsed entries carry. Lower than `entries_parsed` means at least one label is duplicated."
        },
        "numerals_duplicated": {
          "type": "array",
          "description": "Labels carried by more than one parsed entry. A difference of two totals cannot reveal a duplicate at all.",
          "items": {
            "type": "string"
          }
        },
        "numerals_absent": {
          "type": "array",
          "description": "Labels from 1 to `labels_max` carried by no parsed entry. Only visible where the printed numerals survived the converter: three of the four parse paths label by position, and a positional run has no gaps by construction.",
          "items": {
            "type": "string"
          }
        }
      }
    },
    "manuscript_supplements": {
      "type": "array",
      "description": "Supplementary material belonging to the AUDITED paper, supplied with --supplement. Deliberately not an entry in `entries`: it answers for no citation label, so putting it there would inflate the reference total and let a claim citing a number be handed the paper's own appendix. Absent on manifests written before 0.6.0.",
      "items": {
        "type": "object",
        "required": [
          "slug",
          "pdf_path"
        ],
        "properties": {
          "slug": {
            "type": "string",
            "description": "The id this document is read, ingested and cropped under, derived from the file stem."
          },
          "pdf_path": {
            "type": "string",
            "description": "Local path to the supplementary PDF, as supplied by the user."
          }
        }
      }
    },
    "numbering_corroborated": {
      "type": "boolean",
      "description": "True when every label the manuscript cites was agreed by two or more independent readings of the bibliography. A second, independent axis from `numbering_verified`, which is about matching the body's labels, not about readings agreeing with each other — a manifest can be verified and uncorroborated, or corroborated and unverified. Absent means never computed, not 'not corroborated'."
    },
    "corroborating_readings": {
      "type": "array",
      "description": "Which named readings (e.g. 'parsed', 'pymupdf', 'llm') fed `numbering_corroborated`, named rather than merely counted. Absent means never computed.",
      "items": {
        "type": "string"
      }
    },
    "labels_disputed": {
      "type": "array",
      "description": "Citation labels where two or more readings of the bibliography actively named different papers, so the verdict on any claim citing them was withheld rather than printed. Absent means never computed — NOT 'none disputed' — the same three-state discipline as `table_warnings`.",
      "items": {
        "type": "string"
      }
    },
    "labels_resolved": {
      "type": "array",
      "description": "Citation labels that were in `labels_disputed` and were then settled — by a targeted model call the user accepted, or by the user choosing one reading whole. Absent means never computed, not 'none resolved'.",
      "items": {
        "type": "string"
      }
    },
    "numbering_choice": {
      "type": "string",
      "enum": [
        "",
        "withheld",
        "llm_resolved",
        "parsed",
        "pymupdf"
      ],
      "description": "How a disputed numbering was left, when the interactive escalation ran. '' means the escalation never ran, which is true of most manifests. Never set from a model's own say-so alone — see `numbering_chosen_by`."
    },
    "numbering_chosen_by": {
      "type": "string",
      "enum": [
        "",
        "default",
        "user"
      ],
      "description": "Who is responsible for `numbering_choice`: '' when no escalation ran, 'default' when nobody was actually asked, 'user' when a person consented to it. A person consenting to proceed is an input, never evidence that the numbering was verified — `numbering_verified` cannot be set from this."
    },
    "reflist_outcome": {
      "type": "string",
      "enum": ["", "not_attempted", "failed", "read"],
      "description": "Which of the three real outcomes this run's model reading of the bibliography reached: 'not_attempted' (no subprocess call was ever made — --llm-refs off, --parse-only, the backend left no second reading to compare against, or claude not on PATH), 'failed' (a call was made and did not return an answer), or 'read' (a reply was obtained, whether or not anything in it survived verification). Absent or '' means NEVER COMPUTED, not 'not_attempted' — a manifest written before this field existed asserts nothing about whether a call was made. A two-valued flag could not tell 'never called' apart from 'called and failed', which is exactly the bug this field replaced: a failed call published as a successful reading."
    },
    "reflist_failure": {
      "type": "string",
      "description": "Why there is no reading, when `reflist_outcome` is not 'read' — never a value that failed verification (`reflist_fields_discarded`'s job). '' when `reflist_outcome` is 'read', or when neither has ever been computed."
    },
    "reflist_model": {
      "type": "string",
      "description": "The model that produced the LLM's structured reading of the bibliography, when --llm-refs ran, produced anything usable, AND the reply itself reported a model name. '' means EITHER no such call was made OR one was made, verified and voted but did not report which model answered — see `reflist_outcome` for which; this field alone cannot tell them apart, and never means the reading was rejected."
    },
    "reflist_fields_discarded": {
      "type": "array",
      "description": "Which fields of the LLM's proposed reading could not be found verbatim in either text it was shown, and were discarded rather than trusted. Absent or empty means either no LLM reading was attempted, or every field it proposed was verified.",
      "items": {
        "type": "string"
      }
    },
    "reflist_numbering_findings": {
      "type": "array",
      "description": "Findings about the model reading's own labels rather than its values: a numeral it proposed twice, or a gap in 1..max. Kept apart from `reflist_fields_discarded` because nothing went missing — folding the two would report a count of discarded values that includes things no value ever lost. Empty means none were found, which on a reading that produced no entries is not the same as none being present.",
      "items": {
        "type": "string"
      }
    },
    "reflist_entries_proposed": {
      "type": "integer",
      "description": "How many entries the model's reply proposed, before verification, whenever `reflist_outcome` is 'read' — including 0. Absent or 0 on a manifest where `reflist_outcome` is not 'read' means never computed, not 'proposed nothing'. Without this a reader cannot tell a model that proposed no entries at all from one that proposed several and had none discarded — both otherwise print '0 fields discarded'."
    }
  }
}
